{
  "attemptOrdinal": 1,
  "authorityCommitSha": "28fe4349eb40d137e3389b2f8e3c8d76f8fa7bb3",
  "automaticRetries": 0,
  "candidateId": "qwen3-tts-1-7b-customvoice-cuda-bf16-v1",
  "cases": [
    {
      "caseId": "cold-neutral-success",
      "commandToCompleteUnitMilliseconds": 16071.664599999998,
      "commandToFirstTransportFrameMilliseconds": 16071.152900000001,
      "deliveredAudioBytes": 1082880,
      "elapsedMilliseconds": 16071.664599999998,
      "failureCode": null,
      "mediaDurationSeconds": 11.28,
      "nativeFrameHandoffMicroseconds": 233.5,
      "outcome": "pass",
      "publishedAudioUnits": 1,
      "rtf": 1.4247929609929078,
      "terminationMilliseconds": null
    },
    {
      "caseId": "warm-spanish-success",
      "commandToCompleteUnitMilliseconds": 21382.9957,
      "commandToFirstTransportFrameMilliseconds": 21382.4382,
      "deliveredAudioBytes": 1428480,
      "elapsedMilliseconds": 21382.9957,
      "failureCode": null,
      "mediaDurationSeconds": 14.88,
      "nativeFrameHandoffMicroseconds": 158.5,
      "outcome": "pass",
      "publishedAudioUnits": 1,
      "rtf": 1.4370292809139784,
      "terminationMilliseconds": null
    },
    {
      "caseId": "blocked-consumer-backpressure",
      "commandToCompleteUnitMilliseconds": null,
      "commandToFirstTransportFrameMilliseconds": null,
      "deliveredAudioBytes": 0,
      "elapsedMilliseconds": 2.7217000000000002,
      "failureCode": null,
      "mediaDurationSeconds": null,
      "nativeFrameHandoffMicroseconds": null,
      "outcome": "pass",
      "publishedAudioUnits": 0,
      "rtf": null,
      "terminationMilliseconds": null
    },
    {
      "caseId": "before-dispatch-invalidation",
      "commandToCompleteUnitMilliseconds": null,
      "commandToFirstTransportFrameMilliseconds": null,
      "deliveredAudioBytes": 0,
      "elapsedMilliseconds": 2.8665000000000003,
      "failureCode": null,
      "mediaDurationSeconds": null,
      "nativeFrameHandoffMicroseconds": null,
      "outcome": "pass",
      "publishedAudioUnits": 0,
      "rtf": null,
      "terminationMilliseconds": null
    },
    {
      "caseId": "after-complete-before-delivery-invalidation",
      "commandToCompleteUnitMilliseconds": 16357.472000000002,
      "commandToFirstTransportFrameMilliseconds": 16357.110599999998,
      "deliveredAudioBytes": 0,
      "elapsedMilliseconds": 16357.472000000002,
      "failureCode": null,
      "mediaDurationSeconds": 11.44,
      "nativeFrameHandoffMicroseconds": 120.60000000000001,
      "outcome": "pass",
      "publishedAudioUnits": 0,
      "rtf": 1.4298489510489512,
      "terminationMilliseconds": null
    },
    {
      "caseId": "accepted-before-output-cancellation",
      "commandToCompleteUnitMilliseconds": null,
      "commandToFirstTransportFrameMilliseconds": null,
      "deliveredAudioBytes": 0,
      "elapsedMilliseconds": 51.556200000000004,
      "failureCode": null,
      "mediaDurationSeconds": null,
      "nativeFrameHandoffMicroseconds": null,
      "outcome": "pass",
      "publishedAudioUnits": 0,
      "rtf": null,
      "terminationMilliseconds": 5.6669
    },
    {
      "caseId": "mid-generation-cancellation",
      "commandToCompleteUnitMilliseconds": null,
      "commandToFirstTransportFrameMilliseconds": null,
      "deliveredAudioBytes": 0,
      "elapsedMilliseconds": 1046.4716999999998,
      "failureCode": null,
      "mediaDurationSeconds": null,
      "nativeFrameHandoffMicroseconds": null,
      "outcome": "pass",
      "publishedAudioUnits": 0,
      "rtf": null,
      "terminationMilliseconds": 5.5734
    },
    {
      "caseId": "child-crash",
      "commandToCompleteUnitMilliseconds": null,
      "commandToFirstTransportFrameMilliseconds": null,
      "deliveredAudioBytes": 0,
      "elapsedMilliseconds": 1050.4649,
      "failureCode": null,
      "mediaDurationSeconds": null,
      "nativeFrameHandoffMicroseconds": null,
      "outcome": "pass",
      "publishedAudioUnits": 0,
      "rtf": null,
      "terminationMilliseconds": 5.7038
    },
    {
      "caseId": "application-exit",
      "commandToCompleteUnitMilliseconds": null,
      "commandToFirstTransportFrameMilliseconds": null,
      "deliveredAudioBytes": 0,
      "elapsedMilliseconds": 1044.5586,
      "failureCode": null,
      "mediaDurationSeconds": null,
      "nativeFrameHandoffMicroseconds": null,
      "outcome": "pass",
      "publishedAudioUnits": 0,
      "rtf": null,
      "terminationMilliseconds": 5.4849
    }
  ],
  "cleanup": {
    "dedicatedGpuBytes": 0,
    "externalConnectionCount": 0,
    "generatedAudioPersisted": false,
    "listenerCount": 0,
    "processTreeRamBytes": 0,
    "sharedGpuBytes": 0
  },
  "conclusions": {
    "backpressure": "pass",
    "cancellationContainment": "pass",
    "cleanupAndRestart": "pass",
    "completeUnitHandoff": "pass",
    "cooperativeCancellation": "unsupported",
    "generalHardwareSupport": "not-claimed",
    "nativeModelStreaming": "unsupported",
    "productionProfile": "not-selected",
    "sustainablePlayback": "not-evaluated"
  },
  "executionCommitSha": "ae00a8568e3abd780faa0ad2c96d8529247716fb",
  "privacy": {
    "containsExceptionOrProcessCommand": false,
    "containsNarrationText": false,
    "containsPathOrEnvironmentValue": false,
    "containsPrivateIdentity": false,
    "containsProcessIdentifier": false,
    "containsWaveformOrAudioBytes": false
  },
  "profileSha256": "1ec39e6bd45064bb8ddd65b43e5ffee76b5a546bb2766f11af2d9c0ee116a2d3",
  "profileVersion": "tts-service-handoff-profile-v1",
  "protocolVersion": 1,
  "resources": {
    "peakDedicatedGpuBytes": 5137555456,
    "peakGpuAllocatingProcesses": 1,
    "peakProcessTreeRamBytes": 4713615360,
    "peakSharedGpuBytes": 81788928,
    "ramSamplingIntervalMilliseconds": 50,
    "vramMethod": "wddm-process-tree-dedicated-and-shared",
    "vramSamplingIntervalMilliseconds": 1000
  },
  "schemaVersion": 1,
  "status": "pass",
  "timings": {
    "commandToCompleteUnitP95Milliseconds": 21382.9957,
    "commandToFirstTransportFrameP95Milliseconds": 21382.4382,
    "initialLoadMilliseconds": 27290.187199999997,
    "initialWarmMilliseconds": 5564.7553,
    "nativeFrameHandoffP95Microseconds": 233.5,
    "restartPrepareP95Milliseconds": 16609.0194,
    "serviceStartMilliseconds": 466.8994,
    "terminationP95Milliseconds": 5.7038
  }
}
